{
  "$schema": "./schemas/taxonomy.schema.json",
  "schemaVersion": "1.0.0",
  "taxonomyVersion": "1.0.0",
  "fields": [
    {
      "id": "shot.frame",
      "label": "Shot frame",
      "description": "The source-defined amount of the applicant visible in the image; source labels remain on each rule.",
      "category": "shot",
      "valueType": "string",
      "unit": null,
      "allowedValues": [
        {
          "id": "full_length",
          "label": "Full length",
          "description": "A head-to-toe or source-labelled full-length frame.",
          "aliases": [
            "full body",
            "full-length"
          ]
        },
        {
          "id": "portrait_length",
          "label": "Portrait length",
          "description": "The distinct portrait-length frame named by a source; it is not automatically equivalent to a headshot.",
          "aliases": [
            "portrait length"
          ]
        },
        {
          "id": "close_up",
          "label": "Close-up",
          "description": "A tightly framed face or head-and-shoulders image.",
          "aliases": [
            "close up",
            "close-up"
          ]
        },
        {
          "id": "headshot",
          "label": "Headshot",
          "description": "A source-labelled headshot without assuming a tighter close-up framing.",
          "aliases": [
            "head shot"
          ]
        },
        {
          "id": "mid_length",
          "label": "Mid-length",
          "description": "A source-labelled mid-length frame without inferring an exact crop boundary.",
          "aliases": [
            "mid length",
            "mid-length"
          ]
        },
        {
          "id": "waist_up",
          "label": "Waist-up",
          "description": "A frame showing the applicant from approximately the waist upward.",
          "aliases": [
            "waist up",
            "waist-up"
          ]
        }
      ],
      "matchabilityDefault": "hybrid"
    },
    {
      "id": "shot.view",
      "label": "Shot view",
      "description": "The applicant's orientation relative to the camera.",
      "category": "shot",
      "valueType": "string",
      "unit": null,
      "allowedValues": [
        {
          "id": "front",
          "label": "Front",
          "description": "The applicant faces the camera.",
          "aliases": [
            "front facing",
            "face on"
          ]
        },
        {
          "id": "profile",
          "label": "Profile",
          "description": "A side profile; left and right are compatible subtypes.",
          "aliases": [
            "side profile",
            "profile left",
            "profile right"
          ]
        }
      ],
      "matchabilityDefault": "automatic"
    },
    {
      "id": "shot.purpose",
      "label": "Shot purpose",
      "description": "A source-defined communicative purpose that cannot always be reduced to framing or pose.",
      "category": "shot",
      "valueType": "string",
      "unit": null,
      "allowedValues": [
        {
          "id": "personality",
          "label": "Personality",
          "description": "An image intended to communicate personality; manual confirmation is required in v1.",
          "aliases": [
            "personality pic",
            "personality picture",
            "personality shot"
          ]
        }
      ],
      "matchabilityDefault": "manual_confirmation"
    },
    {
      "id": "appearance.hair_state",
      "label": "Hair state",
      "description": "How hair is positioned for a shot.",
      "category": "appearance",
      "valueType": "string",
      "unit": null,
      "allowedValues": [
        {
          "id": "pulled_back",
          "label": "Pulled back",
          "description": "Hair is pulled back from the face.",
          "aliases": [
            "hair pulled back",
            "hair back"
          ]
        },
        {
          "id": "away_from_face",
          "label": "Away from face",
          "description": "Hair does not obscure the face, without requiring a specific style.",
          "aliases": [
            "hair away from face",
            "keeping your hair away from your face"
          ]
        },
        {
          "id": "up",
          "label": "Hair up",
          "description": "Hair is worn up, preserving the source's broader wording without assuming a specific tied-back style.",
          "aliases": [
            "hair up"
          ]
        },
        {
          "id": "down",
          "label": "Hair down",
          "description": "Hair is worn down.",
          "aliases": [
            "hair down"
          ]
        },
        {
          "id": "natural",
          "label": "Natural hair",
          "description": "Hair is presented in the source-described natural state; this does not imply a natural hair color.",
          "aliases": [
            "natural hair"
          ]
        }
      ],
      "matchabilityDefault": "hybrid"
    },
    {
      "id": "appearance.hair_color",
      "label": "Hair color",
      "description": "A source form's generic hair-color field when the source does not say the color must be natural.",
      "category": "appearance",
      "valueType": "string",
      "unit": null,
      "allowedValues": [],
      "matchabilityDefault": "manual_confirmation"
    },
    {
      "id": "appearance.eye_color",
      "label": "Eye color",
      "description": "A source form's generic eye-color field when the source does not say the color must be natural.",
      "category": "appearance",
      "valueType": "string",
      "unit": null,
      "allowedValues": [],
      "matchabilityDefault": "manual_confirmation"
    },
    {
      "id": "appearance.makeup_level",
      "label": "Makeup level",
      "description": "The visible level of makeup in an image.",
      "category": "appearance",
      "valueType": "string",
      "unit": null,
      "allowedValues": [
        {
          "id": "none",
          "label": "No makeup",
          "description": "No visible makeup.",
          "aliases": [
            "no make-up",
            "without makeup"
          ]
        },
        {
          "id": "minimal",
          "label": "Minimal makeup",
          "description": "A minimal or natural-looking makeup presentation.",
          "aliases": [
            "natural makeup"
          ]
        },
        {
          "id": "styled",
          "label": "Styled makeup",
          "description": "Clearly styled or prominent makeup.",
          "aliases": [
            "full makeup"
          ]
        }
      ],
      "matchabilityDefault": "automatic"
    },
    {
      "id": "appearance.accessory_type",
      "label": "Accessory type",
      "description": "An accessory category explicitly addressed by a submission source.",
      "category": "appearance",
      "valueType": "string",
      "unit": null,
      "allowedValues": [
        {
          "id": "large",
          "label": "Large accessories",
          "description": "Large or visually distracting accessories.",
          "aliases": [
            "large accessories",
            "hoop earrings",
            "bracelets"
          ]
        },
        {
          "id": "jewelry",
          "label": "Jewelry",
          "description": "Jewelry of any size when a source addresses the category generally.",
          "aliases": [
            "jewellery"
          ]
        }
      ],
      "matchabilityDefault": "hybrid"
    },
    {
      "id": "appearance.hair_product_used",
      "label": "Hair product used",
      "description": "Whether hair product is visibly used or declared for the submitted image.",
      "category": "appearance",
      "valueType": "boolean",
      "unit": null,
      "allowedValues": [],
      "matchabilityDefault": "manual_confirmation"
    },
    {
      "id": "appearance.natural_hair_color",
      "label": "Natural hair color",
      "description": "The applicant's self-reported natural hair color.",
      "category": "appearance",
      "valueType": "string",
      "unit": null,
      "allowedValues": [],
      "matchabilityDefault": "manual_confirmation"
    },
    {
      "id": "appearance.natural_eye_color",
      "label": "Natural eye color",
      "description": "The applicant's self-reported natural eye color.",
      "category": "appearance",
      "valueType": "string",
      "unit": null,
      "allowedValues": [],
      "matchabilityDefault": "manual_confirmation"
    },
    {
      "id": "expression.smile",
      "label": "Smile visible",
      "description": "Whether the applicant is smiling in the image.",
      "category": "expression",
      "valueType": "boolean",
      "unit": null,
      "allowedValues": [],
      "matchabilityDefault": "automatic"
    },
    {
      "id": "expression.style",
      "label": "Expression style",
      "description": "A source-defined overall facial expression or posing direction that is not safely reducible to smile presence alone.",
      "category": "expression",
      "valueType": "string",
      "unit": null,
      "allowedValues": [
        {
          "id": "neutral",
          "label": "Neutral",
          "description": "A neutral facial expression without an inferred mood.",
          "aliases": [
            "neutral facial expression",
            "neutral expression"
          ]
        },
        {
          "id": "natural_relaxed",
          "label": "Natural and relaxed",
          "description": "A natural, relaxed presentation rather than an assumed formal pose.",
          "aliases": [
            "natural and relaxed",
            "most natural and relaxed"
          ]
        }
      ],
      "matchabilityDefault": "hybrid"
    },
    {
      "id": "clothing.fit",
      "label": "Clothing fit",
      "description": "How closely clothing follows the applicant's body shape.",
      "category": "clothing",
      "valueType": "string",